[
  {
    "id": "71000000-0000-4000-8000-000000000001",
    "trip_city_id": "cc000000-0000-4000-8000-000000000001",
    "poi_id": "72000000-0000-4000-8000-000000000001",
    "position": "a0",
    "state": "must_do",
    "added_by": "aa000000-0000-4000-8000-000000000001",
    "est_duration": 45,
    "created_at": "2026-06-10T10:00:00Z",
    "updated_at": "2026-06-11T10:00:00Z"
  },
  {
    "id": "71000000-0000-4000-8000-000000000002",
    "trip_city_id": "cc000000-0000-4000-8000-000000000001",
    "poi_id": "72000000-0000-4000-8000-000000000002",
    "position": "a1",
    "state": "kept",
    "added_by": "aa000000-0000-4000-8000-000000000002",
    "est_duration": 60,
    "created_at": "2026-06-10T11:01:00Z",
    "updated_at": "2026-06-11T11:01:00Z"
  },
  {
    "id": "71000000-0000-4000-8000-000000000003",
    "trip_city_id": "cc000000-0000-4000-8000-000000000001",
    "poi_id": "72000000-0000-4000-8000-000000000003",
    "position": "a2",
    "state": "kept",
    "added_by": "aa000000-0000-4000-8000-000000000003",
    "est_duration": 90,
    "created_at": "2026-06-10T12:02:00Z",
    "updated_at": "2026-06-11T12:02:00Z"
  },
  {
    "id": "71000000-0000-4000-8000-000000000004",
    "trip_city_id": "cc000000-0000-4000-8000-000000000001",
    "poi_id": "72000000-0000-4000-8000-000000000004",
    "position": "a2V",
    "state": "suggested",
    "added_by": "aa000000-0000-4000-8000-000000000001",
    "est_duration": 120,
    "created_at": "2026-06-10T13:03:00Z",
    "updated_at": "2026-06-11T13:03:00Z"
  },
  {
    "id": "71000000-0000-4000-8000-000000000005",
    "trip_city_id": "cc000000-0000-4000-8000-000000000001",
    "poi_id": "72000000-0000-4000-8000-000000000005",
    "position": "a3",
    "state": "suggested",
    "added_by": "aa000000-0000-4000-8000-000000000002",
    "est_duration": 30,
    "created_at": "2026-06-10T14:04:00Z",
    "updated_at": "2026-06-11T14:04:00Z"
  },
  {
    "id": "71000000-0000-4000-8000-000000000006",
    "trip_city_id": "cc000000-0000-4000-8000-000000000001",
    "poi_id": "72000000-0000-4000-8000-000000000006",
    "position": "a4",
    "state": "suggested",
    "added_by": "aa000000-0000-4000-8000-000000000003",
    "est_duration": null,
    "created_at": "2026-06-10T15:05:00Z",
    "updated_at": "2026-06-11T15:05:00Z"
  },
  {
    "id": "71000000-0000-4000-8000-000000000007",
    "trip_city_id": "cc000000-0000-4000-8000-000000000001",
    "poi_id": "72000000-0000-4000-8000-000000000007",
    "position": "a5",
    "state": "removed",
    "added_by": "aa000000-0000-4000-8000-000000000001",
    "est_duration": 75,
    "created_at": "2026-06-10T16:00:00Z",
    "updated_at": "2026-06-11T16:00:00Z"
  },
  {
    "id": "71000000-0000-4000-8000-000000000008",
    "trip_city_id": "cc000000-0000-4000-8000-000000000001",
    "poi_id": "72000000-0000-4000-8000-000000000008",
    "position": "a6",
    "state": "must_do",
    "added_by": "aa000000-0000-4000-8000-000000000002",
    "est_duration": 150,
    "created_at": "2026-06-10T17:01:00Z",
    "updated_at": "2026-06-11T17:01:00Z"
  },
  {
    "id": "71000000-0000-4000-8000-000000000009",
    "trip_city_id": "cc000000-0000-4000-8000-000000000001",
    "poi_id": "72000000-0000-4000-8000-000000000009",
    "position": "a7",
    "state": "kept",
    "added_by": "aa000000-0000-4000-8000-000000000003",
    "est_duration": 45,
    "created_at": "2026-06-10T18:02:00Z",
    "updated_at": "2026-06-11T18:02:00Z"
  },
  {
    "id": "71000000-0000-4000-8000-00000000000a",
    "trip_city_id": "cc000000-0000-4000-8000-000000000001",
    "poi_id": "72000000-0000-4000-8000-00000000000a",
    "position": "a8",
    "state": "kept",
    "added_by": "aa000000-0000-4000-8000-000000000001",
    "est_duration": 60,
    "created_at": "2026-06-10T19:03:00Z",
    "updated_at": "2026-06-11T19:03:00Z"
  },
  {
    "id": "71000000-0000-4000-8000-00000000000b",
    "trip_city_id": "cc000000-0000-4000-8000-000000000001",
    "poi_id": "72000000-0000-4000-8000-00000000000b",
    "position": "a9",
    "state": "suggested",
    "added_by": "aa000000-0000-4000-8000-000000000002",
    "est_duration": 90,
    "created_at": "2026-06-10T10:04:00Z",
    "updated_at": "2026-06-11T10:04:00Z"
  },
  {
    "id": "71000000-0000-4000-8000-00000000000c",
    "trip_city_id": "cc000000-0000-4000-8000-000000000001",
    "poi_id": "72000000-0000-4000-8000-00000000000c",
    "position": "aA",
    "state": "suggested",
    "added_by": "aa000000-0000-4000-8000-000000000003",
    "est_duration": 120,
    "created_at": "2026-06-10T11:05:00Z",
    "updated_at": "2026-06-11T11:05:00Z"
  },
  {
    "id": "71000000-0000-4000-8000-00000000000d",
    "trip_city_id": "cc000000-0000-4000-8000-000000000001",
    "poi_id": "72000000-0000-4000-8000-00000000000d",
    "position": "aB",
    "state": "suggested",
    "added_by": "aa000000-0000-4000-8000-000000000001",
    "est_duration": 30,
    "created_at": "2026-06-10T12:00:00Z",
    "updated_at": "2026-06-11T12:00:00Z"
  },
  {
    "id": "71000000-0000-4000-8000-00000000000e",
    "trip_city_id": "cc000000-0000-4000-8000-000000000001",
    "poi_id": "72000000-0000-4000-8000-00000000000e",
    "position": "aBV",
    "state": "removed",
    "added_by": "aa000000-0000-4000-8000-000000000002",
    "est_duration": null,
    "created_at": "2026-06-10T13:01:00Z",
    "updated_at": "2026-06-11T13:01:00Z"
  },
  {
    "id": "71000000-0000-4000-8000-00000000000f",
    "trip_city_id": "cc000000-0000-4000-8000-000000000001",
    "poi_id": "72000000-0000-4000-8000-00000000000f",
    "position": "aC",
    "state": "must_do",
    "added_by": "aa000000-0000-4000-8000-000000000003",
    "est_duration": 75,
    "created_at": "2026-06-10T14:02:00Z",
    "updated_at": "2026-06-11T14:02:00Z"
  },
  {
    "id": "71000000-0000-4000-8000-000000000010",
    "trip_city_id": "cc000000-0000-4000-8000-000000000001",
    "poi_id": "72000000-0000-4000-8000-000000000010",
    "position": "aD",
    "state": "kept",
    "added_by": "aa000000-0000-4000-8000-000000000001",
    "est_duration": 150,
    "created_at": "2026-06-10T15:03:00Z",
    "updated_at": "2026-06-11T15:03:00Z"
  },
  {
    "id": "71000000-0000-4000-8000-000000000011",
    "trip_city_id": "cc000000-0000-4000-8000-000000000001",
    "poi_id": "72000000-0000-4000-8000-000000000011",
    "position": "aE",
    "state": "kept",
    "added_by": "aa000000-0000-4000-8000-000000000002",
    "est_duration": 45,
    "created_at": "2026-06-10T16:04:00Z",
    "updated_at": "2026-06-11T16:04:00Z"
  },
  {
    "id": "71000000-0000-4000-8000-000000000012",
    "trip_city_id": "cc000000-0000-4000-8000-000000000001",
    "poi_id": "72000000-0000-4000-8000-000000000012",
    "position": "aF",
    "state": "suggested",
    "added_by": "aa000000-0000-4000-8000-000000000003",
    "est_duration": 60,
    "created_at": "2026-06-10T17:05:00Z",
    "updated_at": "2026-06-11T17:05:00Z"
  },
  {
    "id": "71000000-0000-4000-8000-000000000013",
    "trip_city_id": "cc000000-0000-4000-8000-000000000001",
    "poi_id": "72000000-0000-4000-8000-000000000013",
    "position": "aG",
    "state": "suggested",
    "added_by": "aa000000-0000-4000-8000-000000000001",
    "est_duration": 90,
    "created_at": "2026-06-10T18:00:00Z",
    "updated_at": "2026-06-11T18:00:00Z"
  },
  {
    "id": "71000000-0000-4000-8000-000000000014",
    "trip_city_id": "cc000000-0000-4000-8000-000000000001",
    "poi_id": "72000000-0000-4000-8000-000000000014",
    "position": "aH",
    "state": "suggested",
    "added_by": "aa000000-0000-4000-8000-000000000002",
    "est_duration": 120,
    "created_at": "2026-06-10T19:01:00Z",
    "updated_at": "2026-06-11T19:01:00Z"
  },
  {
    "id": "71000000-0000-4000-8000-000000000015",
    "trip_city_id": "cc000000-0000-4000-8000-000000000001",
    "poi_id": "72000000-0000-4000-8000-000000000015",
    "position": "aI",
    "state": "removed",
    "added_by": "aa000000-0000-4000-8000-000000000003",
    "est_duration": 30,
    "created_at": "2026-06-10T10:02:00Z",
    "updated_at": "2026-06-11T10:02:00Z"
  },
  {
    "id": "71000000-0000-4000-8000-000000000016",
    "trip_city_id": "cc000000-0000-4000-8000-000000000001",
    "poi_id": "72000000-0000-4000-8000-000000000016",
    "position": "aJ",
    "state": "must_do",
    "added_by": "aa000000-0000-4000-8000-000000000001",
    "est_duration": null,
    "created_at": "2026-06-10T11:03:00Z",
    "updated_at": "2026-06-11T11:03:00Z"
  },
  {
    "id": "71000000-0000-4000-8000-000000000017",
    "trip_city_id": "cc000000-0000-4000-8000-000000000001",
    "poi_id": "72000000-0000-4000-8000-000000000017",
    "position": "aK",
    "state": "kept",
    "added_by": "aa000000-0000-4000-8000-000000000002",
    "est_duration": 75,
    "created_at": "2026-06-10T12:04:00Z",
    "updated_at": "2026-06-11T12:04:00Z"
  },
  {
    "id": "71000000-0000-4000-8000-000000000018",
    "trip_city_id": "cc000000-0000-4000-8000-000000000001",
    "poi_id": "72000000-0000-4000-8000-000000000018",
    "position": "aL",
    "state": "kept",
    "added_by": "aa000000-0000-4000-8000-000000000003",
    "est_duration": 150,
    "created_at": "2026-06-10T13:05:00Z",
    "updated_at": "2026-06-11T13:05:00Z"
  },
  {
    "id": "71000000-0000-4000-8000-000000000019",
    "trip_city_id": "cc000000-0000-4000-8000-000000000001",
    "poi_id": "72000000-0000-4000-8000-000000000019",
    "position": "aM",
    "state": "suggested",
    "added_by": "aa000000-0000-4000-8000-000000000001",
    "est_duration": 45,
    "created_at": "2026-06-10T14:00:00Z",
    "updated_at": "2026-06-11T14:00:00Z"
  },
  {
    "id": "71000000-0000-4000-8000-00000000001a",
    "trip_city_id": "cc000000-0000-4000-8000-000000000001",
    "poi_id": "72000000-0000-4000-8000-00000000001a",
    "position": "aN",
    "state": "suggested",
    "added_by": "aa000000-0000-4000-8000-000000000002",
    "est_duration": 60,
    "created_at": "2026-06-10T15:01:00Z",
    "updated_at": "2026-06-11T15:01:00Z"
  },
  {
    "id": "71000000-0000-4000-8000-00000000001b",